id	timestamp	hypothesis	change_summary	issue_number	pr_number	score_before	score_after	delta	verdict	cost_usd	notes	research_citations
1	2026-08-19T14:46:24.985448	Add manual capture features — popup button, context menu, keyboard shortcut (issues #6, #7, #8)			12				revert	3.7178692500000006	[OVERRIDDEN by finalize gate] precheck failed: score_direction. ceo:keep score_delta=+0.002 composite=0.308 baseline=0.306 tests_pass=166/166 guard_violations=0 qa_clean=true precheck_halted=threshold_below_0.5_preexisting capability_surface_added=context_menu+keyboard_shortcut+popup_button	
2	2026-08-19T16:07:22.553270				12				revert	7.459754499999999	[OVERRIDDEN by finalize gate] precheck failed: score_direction. ceo:keep composite=0.5346 delta=+0.2266 tests=1.0(was_0.0) type_check=0.95(was_0.0) coverage=0.69(was_0.50) root_cause=factory_detected_jest_instead_of_vitest_for_root_sub_project qa_iterations=1 pr=12	
2	2026-08-19T16:07:35.793663	Fix vitest workspace isolation and TypeScript strict mode errors	Added vitest workspace config, fixed 46 TS errors, added vitest to root devDeps for correct test runner detection	13	12	0.308	0.5346	0.2266	keep	7.459754499999999	ceo:keep composite=0.5346 delta=+0.2266 tests=1.0(was_0.0) type_check=0.95(was_0.0) coverage=0.69(was_0.50) root_cause=factory_detected_jest_instead_of_vitest qa_iterations=1	
3	2026-08-19T16:19:22.339811	Add Pino structured logging for observability growth	Created shared logger module, browser-safe logger, instrumented 8+ source files with structured JSON logging, added requestId tracing to CLI commands		12	0.5346	0.5865	0.0519	keep	3.9962047	ceo:keep composite=0.5865 delta=+0.0519 observability=0.708(was_0.176) health=PASS code_review=PROCEED adversarial=PASS qa_iterations=1	
4	2026-08-19T16:29:59.487987	Re-attempt manual capture features for capability_surface growth	Manual capture features from cycle 1 now kept (context menu + keyboard shortcut). Fixed contextMenus.create placement to onInstalled listener. Added structured logging to handlers.		12	0.5865	0.6049	0.0184	keep	3.5184066499999997	ceo:keep composite=0.6049 delta=+0.0184 experiment_diversity=0.686(was_0.5) factory_effectiveness=0.525(was_0.5) qa_iterations=2 redirect_reason=contextMenus_not_in_onInstalled	
